{
  "plan_analysis": "Correcting a syntax error in the previous proposal's JSON formatting. The logic remains the same: implementing a modular Adapter pattern with `TiingoSimAdapter` to synchronize the Simulator's data with the Live Bot's Tiingo-sourced 'Data Lake'. This includes creating the adapter, a new entry point `main_tiingo_sim.py`, and updating `run_simulation` in `main_sim.py` to support pre-loaded data.",
  "summary": "Fixing JSON syntax error and proceeding with Tiingo data integration for simulation parity.",
  "event_type": "fix",
  "commands": [
    {
      "command": "create_file",
      "path": "simulation/data_code/tiingo_adapter.py",
      "content": "import pandas as pd\nimport numpy as np\nfrom simulation.data_code.cache_manager import DataCacheManager\n\nclass TiingoSimAdapter:\n    def __init__(self, tickers, token):\n        self.cache = DataCacheManager(tickers, token)\n        self.tickers = tickers\n\n    def get_simulation_data(self):\n        \"\"\"\n        Fetches Tiingo data and transforms it into the M5, H1, and D1 \n        formats required by the simulation engine.\n        \"\"\"\n        print(f\"🌐 [TIINGO ADAPTER] Synchronizing Unified Data Lake...\")\n        # 1. Get the Master M5 Timeline (The 'Matter')\n        m5_master = self.cache.sync_and_load_history()\n        \n        h1_map = {}\n        d1_map = {}\n\n        print(f\"📊 [TIINGO ADAPTER] Resampling Physics Manifolds (H1/D1)...\")\n        for t in self.tickers:\n            # 2. Derive H1 Physics Map from M5 to ensure 100% alignment\n            df_h1 = m5_master[[t]].resample('1h').last().dropna()\n            df_h1 = df_h1.reset_index().rename(columns={'index': 'time', t: 'close'})\n            h1_map[t] = df_h1\n\n            # 3. Derive D1 Macro Map using the cache_manager's daily_master logic\n            if t in self.cache.daily_master.index.get_level_values('ticker'):\n                ticker_d1 = self.cache.daily_master.xs(t, level='ticker').copy()\n                # Re-insert 'close' for the portfolio manager's golden_list logic\n                daily_closes = m5_master[t].resample('D').last()\n                ticker_d1['close'] = daily_closes\n                d1_map[t] = ticker_d1.dropna()\n\n        return m5_master, h1_map, d1_map"
    },
    {
      "command": "create_file",
      "path": "simulation/main_tiingo_sim.py",
      "content": "import os\nimport sys\nfrom datetime import datetime\n\n# Ensure resolution of simulation and live modules\nroot_dir = os.path.dirname(os.path.dirname(os.path.abspath(__file__)))\nif root_dir not in sys.path:\n    sys.path.append(root_dir)\n\nfrom simulation.main_sim import run_simulation\nfrom simulation.data_code.tiingo_adapter import TiingoSimAdapter\n# Reuse config from live bot for 100% parity\nfrom live.main_live import ASSETS, TIINGO_TOKEN, VIRTUAL_CAPITAL_USD, MAX_SLOTS\n\ndef run_tiingo_parity_test():\n    print(\"\\n\" + \"=\"*60)\n    print(\"🚀 STARTING TIINGO PARITY SIMULATION\")\n    print(\"Directly mirroring Live Bot data sourcing and physics...\")\n    print(\"=\"*60 + \"\\n\")\n\n    # 1. Initialize the Adapter\n    adapter = TiingoSimAdapter(ASSETS, TIINGO_TOKEN)\n\n    # 2. Fetch/Sync data\n    m5_timeline, h1_map, d1_map = adapter.get_simulation_data()\n\n    # 3. Run simulation with pre-loaded parity data\n    run_simulation(\n        tickers=ASSETS, \n        initial_capital=VIRTUAL_CAPITAL_USD, \n        slots=MAX_SLOTS, \n        preloaded_data=(m5_timeline, h1_map, d1_map)\n    )\n\nif __name__ == \"__main__\":\n    run_tiingo_parity_test()"
    },
    {
      "command": "update_file",
      "path": "simulation/main_sim.py",
      "content": "import sys\nimport os\nimport glob\nimport pandas as pd\nfrom datetime import timedelta\n\nroot_dir = os.path.dirname(os.path.dirname(os.path.abspath(__file__)))\nif root_dir not in sys.path:\n    sys.path.append(root_dir)\n\nfrom simulation.core.master_controller_V2 import LiveGatedForge\nfrom simulation.core.portfolio_manager import PortfolioManager\nfrom simulation.execution.broker_sim import SimBroker\nfrom simulation.data_code.data_processor import LocalDataIngestor\nfrom simulation.core.math_utils import get_friction\n\ndef run_simulation(tickers, initial_capital, slots=1, lookback=30, start=None, end=None, debug=True, preloaded_data=None):\n    data_dir = \"data\" if os.path.exists(\"data\") else \"bot/data\"\n    \n    if preloaded_data:\n        m5_timeline, h1_map, d1_map = preloaded_data\n    else:\n        if tickers == [\"ALL\"]:\n            print(f\"\\n[DISCOVERY] Scanning '{data_dir}/' for complete asset universe...\")\n            m5_files = glob.glob(f\"{data_dir}/*_M5_sync_AI.csv\")\n            valid_tickers = []\n            for f in m5_files:\n                t = os.path.basename(f).replace('_M5_sync_AI.csv', '')\n                if os.path.exists(f\"{data_dir}/{t}_H1_sync_AI.csv\") and os.path.exists(f\"{data_dir}/{t}_D1_sync_AI.csv\"):\n                    valid_tickers.append(t)\n            tickers = sorted(valid_tickers)\n            print(f\"[DISCOVERY] Found {len(tickers)} valid assets with full Manifold data.\")\n            \n            if not tickers:\n                print(\"❌ No valid assets found in data directory.\")\n                return\n\n        ingestor = LocalDataIngestor(data_dir=data_dir)\n        m5_timeline, h1_map, d1_map = ingestor.load_aligned_data(tickers, start, end)\n    \n    if m5_timeline.empty:\n        print(\"❌ No data found for the given criteria.\")\n        return\n\n    broker = SimBroker(initial_capital, slots)\n    portfolio = PortfolioManager(tickers, slots, lookback_days=lookback)\n    forges = {t: LiveGatedForge(t) for t in tickers}\n\n    h1_ptrs = {t: 0 for t in tickers}\n\n    sim_start = m5_timeline.index[0]\n    warmup_end = sim_start + timedelta(days=lookback + 10)\n    \n    print(f\"\\n=== SIMULATION ENGINE ARMED ===\")\n    print(f\"Initial Capital: ${initial_capital:,.2f} | Slots: {slots}\")\n    print(f\"Universe Size:   {len(tickers)} Assets\")\n    print(f\"Lookback Window: {lookback} Days\")\n    print(f\"Data Points:     {len(m5_timeline)} ticks\")\n    print(f\"Start Date:      {sim_start}\")\n    print(f\"Warmup Ends:     {warmup_end}\")\n    print(f\"End Date:        {m5_timeline.index[-1]}\\n\")\n    \n    last_week = -1\n    last_quarter = -1\n    last_h1_hour = -1\n    last_warmup_print = None\n\n    for current_time, row in m5_timeline.iterrows():\n        current_week = current_time.isocalendar()[1]\n        is_warmup = current_time < warmup_end\n        \n        is_h1_close = current_time.hour != last_h1_hour\n        if is_h1_close: \n            last_h1_hour = current_time.hour\n            broker.record_equity(current_time, row)\n\n        if not portfolio.golden_list or (current_week % 13 == 0 and current_week != last_quarter):\n            portfolio.rebuild_golden_list(current_time, d1_map)\n            last_quarter = current_week\n\n        if not portfolio.active_roster or current_week != last_week:\n            portfolio.rebuild_active_roster(current_time, d1_map)\n            last_week = current_week\n\n        for t in tickers:\n            h1_df = h1_map.get(t)\n            if h1_df is not None:\n                while h1_ptrs[t] < len(h1_df) and h1_df.at[h1_ptrs[t], 'time'] <= current_time:\n                    forges[t].ingest_h1(h1_df.at[h1_ptrs[t], 'close'])\n                    h1_ptrs[t] += 1\n            \n            price = row.get(t)\n            if pd.notna(price) and price > 0:\n                forges[t].ingest_m5(price)\n\n        if not is_warmup:\n            held = broker.get_holdings()\n            active = portfolio.active_roster\n\n            for t in list(held):\n                sig = forges[t].get_signal()\n                current_flux = forges[t].state.get('H1_Flux', 0)\n                force_exit = False\n                \n                if sig == 'WAIT':\n                    force_exit = True\n                else:\n                    cands = [c for c in active if forges[c].get_signal() == 'LONG' and c != t]\n                    if cands:\n                        best_alt = max(cands, key=lambda x: forges[x].state.get('H1_Flux', 0) * (1 - (get_friction(x) * 10)))\n                        best_flux = forges[best_alt].state.get('H1_Flux', 0)\n                        dynamic_hurdle = 1.5 + (get_friction(best_alt) * 100)\n                        if best_flux > (current_flux * dynamic_hurdle):\n                            force_exit = True\n                            \n                if t not in active:\n                    force_exit = True\n                    \n                if force_exit:\n                    safe_price = row.get(t, 0.0) if not pd.isna(row.get(t)) else 0.0\n                    if safe_price > 0:\n                        broker.execute(t, 'SELL', safe_price)\n            \n            held = broker.get_holdings()\n            if len(held) < slots:\n                cands = [t for t in active if forges[t].get_signal() == 'LONG' and t not in held]\n                if cands:\n                    best_asset = max(cands, key=lambda x: forges[x].state.get('H1_Flux', 0) * (1 - (get_friction(x) * 10)))\n                    price = row.get(best_asset)\n                    if pd.notna(price) and price > 0:\n                        broker.execute(best_asset, 'BUY', price)\n                        \n        else:\n            if last_warmup_print != current_time.date():\n                print(f\"  [WARMUP] Ingesting history for {current_time.date()}...   \", end='\\r')\n                last_warmup_print = current_time.date()\n\n    print(\"\\n\")\n    broker.print_results(m5_timeline.iloc[-1])\n    broker.generate_tearsheet(warmup_end=warmup_end)"
    }
  ]
}